Question,Answer
What is Castle Swimmer about?,"Castle Swimmer is a webtoon that explores themes of adventure, prophecy, and the bonds between characters as they navigate a mystical ocean."
Who are the main characters?,"The main characters include the prince, who is on a quest to fulfill a prophecy, and various companions he meets along the way."
What are the key themes?,"Key themes include friendship, courage, and the struggle against fate."
What happens in chapters 83-89?,Chapters 83-89 unveil new prophecies and developments that impact the journey of the characters.
Can you tell me more about the prophecy?,"The prophecy serves as a guiding force for the characters, influencing their choices and interactions."
